{
  "$schema": "http://json-schema.org/draft-07/schema#",
  "title": "Atomic Chat Foundry Local model list",
  "description": "Models of the `foundry-local` provider, plus where the app finds the rest. The app resolves a variant through `resolver` (an undocumented Azure ML registry endpoint that answers without an account with a short-lived SAS link to the variant's blob container), downloads every listed file into <data>/foundry-local/models/<variant id>/<path>, checking size and sha256, and writes model.yml last. Models of the live Microsoft catalog at `catalog.url` are shown after the curated ones, checked by size only; a curated variant with the same asset id and version wins. The app skips a variant whose `source.kind`, execution provider or device it does not know, and a model left with no variants, so new kinds of source are added next to the old ones.",
  "type": "object",
  "required": ["schema_version", "updated_at", "resolver", "catalog", "models"],
  "additionalProperties": false,
  "properties": {
    "$schema": { "type": "string" },
    "schema_version": { "const": 1 },
    "updated_at": { "type": "string", "format": "date-time" },
    "resolver": {
      "type": "object",
      "required": ["url_template", "regions"],
      "additionalProperties": false,
      "properties": {
        "url_template": {
          "type": "string",
          "pattern": "^https://.*\\{region\\}.*\\{asset_id\\}|^https://.*\\{asset_id\\}.*\\{region\\}",
          "description": "Resolve URL. The app substitutes {region} and the URL-encoded {asset_id} and reads `blobSasUri` (the container link) from the answer."
        },
        "regions": {
          "type": "array",
          "minItems": 1,
          "uniqueItems": true,
          "items": { "type": "string", "pattern": "^[a-z0-9]+$" },
          "description": "Azure regions tried in order until one answers."
        }
      }
    },
    "catalog": {
      "type": "object",
      "required": ["url"],
      "additionalProperties": false,
      "properties": {
        "url": {
          "type": "string",
          "format": "uri",
          "description": "Microsoft model catalog (asset-gallery) the app queries for Foundry Local chat models beyond this list."
        }
      }
    },
    "models": {
      "type": "array",
      "description": "Curated models, shown first in the order listed. May be empty: the Hub then shows the Microsoft catalog only.",
      "items": { "$ref": "#/definitions/model" }
    }
  },
  "definitions": {
    "id": { "type": "string", "pattern": "^[a-z0-9][a-z0-9._-]*$" },
    "path": {
      "type": "string",
      "pattern": "^[A-Za-z0-9_.-]+(/[A-Za-z0-9_.-]+)*$",
      "description": "Relative path without '.' or '..' segments (the integrity check enforces the latter)."
    },
    "model": {
      "type": "object",
      "required": ["id", "name", "description", "task", "license", "context_length", "tools", "reasoning", "variants"],
      "additionalProperties": false,
      "properties": {
        "id": { "$ref": "#/definitions/id" },
        "name": { "type": "string", "minLength": 1 },
        "description": { "type": "string", "minLength": 1 },
        "task": { "type": "string", "enum": ["chat"] },
        "license": { "type": "string", "minLength": 1, "description": "kvTags.license from the resolve answer." },
        "context_length": {
          "type": "integer",
          "minimum": 1,
          "description": "Largest context of the model's variants (kvTags.contextLength). A variant with a smaller one says so itself."
        },
        "tools": { "type": "boolean", "description": "kvTags.supportsToolCalling." },
        "reasoning": { "type": "boolean", "description": "kvTags.supportsReasoning." },
        "variants": {
          "type": "array",
          "minItems": 1,
          "items": { "$ref": "#/definitions/variant" }
        }
      }
    },
    "variant": {
      "type": "object",
      "required": ["id", "device", "execution_provider", "platforms", "source", "files"],
      "additionalProperties": false,
      "properties": {
        "id": {
          "$ref": "#/definitions/id",
          "description": "Unique across the list: names the download task and the folder <data>/foundry-local/models/<id>."
        },
        "device": { "type": "string", "enum": ["cpu", "gpu", "npu"] },
        "execution_provider": {
          "type": "string",
          "enum": ["cpu", "cuda", "webgpu", "openvino", "qnn", "vitisai"],
          "description": "Passed to Foundry Local explicitly when the model is registered."
        },
        "platforms": {
          "type": "array",
          "minItems": 1,
          "uniqueItems": true,
          "items": { "type": "string", "enum": ["win-x64", "win-arm64", "macos-arm64", "linux-x64", "linux-arm64"] }
        },
        "context_length": {
          "type": "integer",
          "minimum": 1,
          "description": "Present only when this variant's context is smaller than the model's (NPU builds are compiled for a short one). The app uses it instead of the model's."
        },
        "source": {
          "oneOf": [{ "$ref": "#/definitions/source_azureml" }]
        },
        "files": {
          "type": "array",
          "minItems": 1,
          "items": { "$ref": "#/definitions/file" }
        }
      }
    },
    "source_azureml": {
      "type": "object",
      "required": ["kind", "asset_id", "version", "path_prefix"],
      "additionalProperties": false,
      "properties": {
        "kind": { "const": "azureml" },
        "asset_id": {
          "type": "string",
          "pattern": "^azureml://registries/[A-Za-z0-9_.-]+/models/[A-Za-z0-9_.-]+/versions/[A-Za-z0-9_.-]+$",
          "description": "Full Azure ML asset id, version included, exactly as the catalog spells it."
        },
        "version": { "type": "string", "pattern": "^[A-Za-z0-9_.-]+$", "description": "The asset id's version segment." },
        "path_prefix": {
          "$ref": "#/definitions/path",
          "description": "Folder inside the container (kvTags.directoryPath). File URLs are <container>/<path_prefix>/<path>."
        }
      }
    },
    "file": {
      "type": "object",
      "required": ["path", "size", "sha256"],
      "additionalProperties": false,
      "properties": {
        "path": { "$ref": "#/definitions/path", "description": "Relative to path_prefix in the container and to the variant folder on disk." },
        "size": { "type": "integer", "minimum": 1 },
        "sha256": { "type": "string", "pattern": "^[0-9a-f]{64}$" }
      }
    }
  }
}
